{
  "$schema": "https://json-schema.org/draft/2020-12/schema",
  "$id": "https://schemas.single-slot-creator.local/paytable.schema.json",
  "title": "Paytable — config/paytable.json",
  "description": "Complete pay definition of the game. All pays are x-bet with at most two decimals, stored as integer hundredths of a bet in payX100 (2.5x -> 250). winMinor = (betMinor * payX100) // 100 (floor); the math model and simulator MUST apply the identical integer rule.",
  "type": "object",
  "additionalProperties": false,
  "required": ["evaluationMode", "directionRule", "entries"],
  "properties": {
    "evaluationMode": {
      "type": "string",
      "enum": ["lines", "ways", "cluster", "scatter_pays"],
      "description": "Win-evaluation archetype this paytable is written for. Must match winEvaluation.mode in game-config.json. scatter_pays = pays-anywhere count thresholds (v1.0.1 widening)."
    },
    "directionRule": {
      "type": "string",
      "enum": ["left_to_right", "right_to_left", "both_ways", "any_adjacent"],
      "description": "Where matched runs may start/extend: leftmost-consecutive (left_to_right), rightmost, both directions, or free adjacency (cluster/any-adjacent games)."
    },
    "entries": {
      "type": "array",
      "minItems": 1,
      "maxItems": 32,
      "description": "Line/ways pay entries — one per paying symbol.",
      "items": {
        "type": "object",
        "additionalProperties": false,
        "required": ["symbolId", "ofAKindPays"],
        "properties": {
          "symbolId": {
            "$ref": "#/$defs/symbolId",
            "description": "Paying symbol; must exist in config/symbols.json."
          },
          "ofAKindPays": {
            "type": "object",
            "description": "Map from match length/count threshold (\"3\"..\"30\", as strings) to pay in payX100 units. For lines/ways: exact of-a-kind counts (3..8). For scatter_pays: ascending band thresholds (e.g. \"8\", \"10\", \"12\" — a count pays the highest threshold <= count). Lengths not listed pay nothing.",
            "minProperties": 1,
            "additionalProperties": false,
            "patternProperties": {
              "^([3-9]|[12][0-9]|30)$": {
                "$ref": "#/$defs/payX100",
                "description": "Pay for this of-a-kind count (lines/ways) or band threshold (scatter_pays), in integer hundredths of a bet."
              }
            }
          }
        }
      }
    },
    "scatterPays": {
      "type": "object",
      "description": "Optional pay-anywhere scatter pays awarded in addition to (or instead of) feature triggers.",
      "additionalProperties": false,
      "required": ["symbolId", "pays"],
      "properties": {
        "symbolId": {
          "$ref": "#/$defs/symbolId",
          "description": "The scatter symbol (normally SCATTER)."
        },
        "pays": {
          "type": "object",
          "description": "Map from scatter count on the grid (\"2\"..\"8\", as strings) to pay in payX100 units.",
          "minProperties": 1,
          "additionalProperties": false,
          "patternProperties": {
            "^[2-8]$": {
              "$ref": "#/$defs/payX100",
              "description": "Total scatter pay for this count, in integer hundredths of a bet."
            }
          }
        }
      }
    },
    "clusterPays": {
      "type": "array",
      "maxItems": 32,
      "description": "Cluster pay bands — required by the config validator when evaluationMode is \"cluster\", forbidden otherwise.",
      "items": {
        "type": "object",
        "additionalProperties": false,
        "required": ["symbolId", "sizeBands"],
        "properties": {
          "symbolId": {
            "$ref": "#/$defs/symbolId",
            "description": "Paying symbol; must exist in config/symbols.json."
          },
          "sizeBands": {
            "type": "array",
            "minItems": 1,
            "maxItems": 16,
            "description": "Non-overlapping, ascending cluster-size bands (config validator checks ordering).",
            "items": {
              "type": "object",
              "additionalProperties": false,
              "required": ["minSize", "maxSize", "payX100"],
              "properties": {
                "minSize": { "type": "integer", "minimum": 4, "maximum": 64, "description": "Smallest cluster size (inclusive) of this band." },
                "maxSize": { "type": "integer", "minimum": 4, "maximum": 64, "description": "Largest cluster size (inclusive) of this band; must be >= minSize." },
                "payX100": { "$ref": "#/$defs/payX100", "description": "Pay for any cluster whose size falls in this band, in integer hundredths of a bet." }
              }
            }
          }
        }
      }
    },
    "wildSubstitutionNote": {
      "type": "string",
      "maxLength": 400,
      "description": "Optional human-readable clarification of wild substitution edge cases (e.g. pure-wild line pays as highest substituted symbol)."
    }
  },
  "allOf": [
    {
      "$comment": "clusterPays is only meaningful for cluster evaluation. Validation message: 'clusterPays requires evaluationMode \"cluster\".'",
      "if": { "required": ["clusterPays"] },
      "then": {
        "properties": { "evaluationMode": { "const": "cluster" } }
      }
    },
    {
      "$comment": "any_adjacent direction only applies to positionless evaluation. Validation message: 'directionRule \"any_adjacent\" requires evaluationMode \"cluster\" or \"scatter_pays\".'",
      "if": {
        "properties": { "directionRule": { "const": "any_adjacent" } },
        "required": ["directionRule"]
      },
      "then": {
        "properties": { "evaluationMode": { "enum": ["cluster", "scatter_pays"] } }
      }
    }
  ],
  "$defs": {
    "payX100": {
      "type": "integer",
      "minimum": 0,
      "maximum": 25000000,
      "description": "Pay as integer hundredths of a bet (x-bet * 100), e.g. 2.5x -> 250. Upper bound = 250000x max-win ceiling * 100."
    },
    "minorUnits": {
      "type": "integer",
      "minimum": 0,
      "description": "Monetary amount in integer minor units (e.g. cents). Never a binary float."
    },
    "semver": {
      "type": "string",
      "pattern": "^\\d+\\.\\d+\\.\\d+$",
      "description": "Semantic version string MAJOR.MINOR.PATCH."
    },
    "sha256": {
      "type": "string",
      "pattern": "^sha256:[0-9a-f]{64}$",
      "description": "Prefixed lowercase-hex SHA-256 digest."
    },
    "tierId": {
      "type": "string",
      "enum": ["feature", "super_feature", "ultimate_feature"],
      "description": "Canonical scatter feature tier id (3 / 4 / 5+ scatters)."
    },
    "symbolId": {
      "type": "string",
      "pattern": "^[A-Z][A-Z0-9_]{0,15}$",
      "description": "Canonical symbol id, e.g. WILD, SCATTER, H1, L3, JP_GRAND."
    },
    "projectSlug": {
      "type": "string",
      "pattern": "^[a-z][a-z0-9-]{2,40}$",
      "description": "Kebab-case project slug used for games/<slug>/."
    },
    "rtp": {
      "type": "number",
      "minimum": 0.8,
      "maximum": 0.99,
      "description": "Return-to-player expressed as a fraction (e.g. 0.9600)."
    }
  }
}
